	ID	QID	QID_	Sentence	Codes	Themes	FirstCC	SecondCC	ThirdCC
0	R0:3			Respondent: I am manager and responsible for disseminating communication and for the extension of the project.	{'business development', 'disseminating communication', 'manager'}	perception	{'business development', 'disseminating communication', 'manager'}	{'business development', 'dissemination practices', 'manager role'}	{'business development', 'dissemination practices', 'research roles and responsibilities'}
1	R0:5			Respondent: In this specific project we started with mapping of stakeholders, that is those organizations that directly or indirectly can yield an added value, or a quid, or are able to influence in general terms the project itself.	{'business development', 'mapping stakeholders', 'tech transfer'}	current situation	{'business development', 'mapping stakeholders', 'tech transfer'}	{'business development', 'mapping stakeholders', 'technology transfer'}	{'business development', 'tech transfer and market orientation', 'stakeholder analysis'}
2	R0:6			We will analyze insights from a first screening of stakeholders and will discuss with them our findings on the [date], to check if priorities are aligned.	{'priorities'}	current situation	{'priorities'}	{'priorities'}	{'priorities'}
3	R0:7			This is a project very much focused on research and has a low TRL (Technology Readiness Level), based on the type of financial scheme that allowed its funding.	{'EU measures', 'EU policy', 'TRL'}	insight	{'EU measures', 'EU policy', 'TRL'}	{'EU innovation measures', 'technology readiness levels', 'EU policy framework'}	{'EU innovation measures', 'EU policy framework', 'EU innovation measures and evaluation metrics'}
3	R0:7			This is a project very much focused on research and has a low TRL (Technology Readiness Level), based on the type of financial scheme that allowed its funding.	{'EU measures', 'EU policy', 'TRL'}	current situation	{'EU measures', 'EU policy', 'TRL'}	{'EU innovation measures', 'technology readiness levels', 'EU policy framework'}	{'EU innovation measures', 'EU policy framework', 'EU innovation measures and evaluation metrics'}
4	R0:9			So dissemination is a type of marketing, we can say.	{'dissemination as marketing'}	insight	{'dissemination as marketing'}	{'dissemination as marketing'}	{'dissemination framed as marketing'}
5	R0:10			Then we will pave the way towards those results that will be implemented, along the way, from technical partners that will prepare the way to reach markets, considering aspects like the product offered by  [X], or the service offered by [X] but also the peculiarity of the partners themselves.	{'pathways from results'}	insight	{'pathways from results'}	{'result-driven pathways'}	{'pathway visualization and roadmapping'}
5	R0:10			Then we will pave the way towards those results that will be implemented, along the way, from technical partners that will prepare the way to reach markets, considering aspects like the product offered by  [X], or the service offered by [X] but also the peculiarity of the partners themselves.	{'pathways from results'}	current situation	{'pathways from results'}	{'result-driven pathways'}	{'pathway visualization and roadmapping'}
6	R0:11			Therefore they will think about business scenarios but I am speaking theoretically at the moment, because there are no concrete results at the moment yet.	{'no business development if no concrete results'}	current situation	{'no business development if no concrete results'}	{'lack of results blocks business'}	{'research-to-market constraints'}
7	R0:12			So my activity concerns how to exploit the results that will be produced, but along the project it is also possible there will be objectives that must be adapted, because if the main results are publications, the main results are - let’s say - knowledge, intangible, and [ exploitation of knowledge ] is not like having a physical product or an online platform or a service… The [project coordinator] said that at the end of the project, his desire would be that the project may lead to a spin-off.	{'business development', 'exploiting results'}	current situation	{'business development', 'exploiting results'}	{'exploitation of results', 'business development'}	{'business development', 'tech transfer and exploitation of results'}
7	R0:12			So my activity concerns how to exploit the results that will be produced, but along the project it is also possible there will be objectives that must be adapted, because if the main results are publications, the main results are - let’s say - knowledge, intangible, and [ exploitation of knowledge ] is not like having a physical product or an online platform or a service… The [project coordinator] said that at the end of the project, his desire would be that the project may lead to a spin-off.	{'business development', 'exploiting results'}	perception	{'business development', 'exploiting results'}	{'exploitation of results', 'business development'}	{'business development', 'tech transfer and exploitation of results'}
8	R0:14			Respondent - University spin-off alike.	{'spin-off', 'tech transfer'}	current situation	{'spin-off', 'tech transfer'}	{'spin-off outcome', 'technology transfer'}	{'tech transfer and market orientation'}
9	R0:24			Respondent - Well, let’s say that if I want to give a general comment for all types of projects, and so the ones similar to this one too, dissemination and communication are certainly parameters.	{'communication', 'dissemination'}	insight	{'communication', 'dissemination'}	{'communication practices', 'dissemination practices'}	{'communication practices', 'dissemination practices'}
10	R0:25			That means that there is a table, described by the European Union, that will require you to fill in numbers about achieved publications, numbers about followers on social platforms, numbers of followers on newsletters etcetera etcetera.	{'scientometrics', 'social networks metrics', 'EU policy', 'EU measures'}	insight	{'scientometrics', 'social networks metrics', 'EU policy', 'EU measures'}	{'social network metrics', 'EU innovation measures', 'scientometrics', 'EU policy framework'}	{'EU innovation measures', 'EU policy framework', 'EU innovation measures and evaluation metrics'}
11	R0:26			So [dissemination and communication] are parameters that allow us to compare different types of projects.	{'measures of innovation for a manager'}	insight	{'measures of innovation for a manager'}	{'managerial innovation measures'}	{'innovation evaluation metrics'}
12	R0:27			I believe that the prolificity of scientific publications is in itself an indicator that tells how innovative a project is.	{'measures of innovation for a manager', 'prolificity'}	perception	{'measures of innovation for a manager', 'prolificity'}	{'managerial innovation measures', 'prolificity as innovation indicator'}	{'innovation evaluation metrics'}
13	R0:28			The projectuality of the contents, of the prospected results - the projectuality itself is already a good index about the innovation of a project, otherwise one could not publish a project that was already prior-art.	{'measures of innovation for a manager', 'prolificity'}	perception	{'measures of innovation for a manager', 'prolificity'}	{'managerial innovation measures', 'prolificity as innovation indicator'}	{'innovation evaluation metrics'}
14	R0:30			Respondent - Yes there are other KPIs as well, as example, within the context of project development, there is TRL - Technology Readness Level, a parameter that is very important at level project.	{'TRL'}	insight	{'TRL'}	{'technology readiness levels'}	{'EU innovation measures and evaluation metrics'}
14	R0:30			Respondent - Yes there are other KPIs as well, as example, within the context of project development, there is TRL - Technology Readness Level, a parameter that is very important at level project.	{'TRL'}	current situation	{'TRL'}	{'technology readiness levels'}	{'EU innovation measures and evaluation metrics'}
15	R0:31			It is about a scale, set by the European Union, and projects are ranked according to this scale.	{'EU measures', 'EU measures are qualitative'}	insight	{'EU measures', 'EU measures are qualitative'}	{'EU innovation measures', 'qualitative nature of EU measures'}	{'EU innovation measures', 'EU innovation measures and evaluation metrics'}
16	R0:32			As example, on a scale 1 - 4, that means 1, representing activities of theoretical research in labs, and 4, representing the closure of a project by achieving a proof-of-concept.	{'proof-of-concept', 'qualifiers', 'theoretical', 'EU measures'}	insight	{'proof-of-concept', 'qualifiers', 'theoretical', 'EU measures'}	{'proof-of-concept', 'theoretical framing', 'EU innovation measures', 'use of qualifiers'}	{'EU innovation measures', 'data collection and reporting practices', 'coding and analysis workflow', 'prototyping and validation'}
16	R0:32			As example, on a scale 1 - 4, that means 1, representing activities of theoretical research in labs, and 4, representing the closure of a project by achieving a proof-of-concept.	{'proof-of-concept', 'qualifiers', 'theoretical', 'EU measures'}	current situation	{'proof-of-concept', 'qualifiers', 'theoretical', 'EU measures'}	{'proof-of-concept', 'theoretical framing', 'EU innovation measures', 'use of qualifiers'}	{'EU innovation measures', 'data collection and reporting practices', 'coding and analysis workflow', 'prototyping and validation'}
17	R0:33			TRL scales progresses up to level 9, that is reachability to market.	{'proof-of-concept', 'qualifiers', 'theoretical', 'EU measures'}	insight	{'proof-of-concept', 'qualifiers', 'theoretical', 'EU measures'}	{'proof-of-concept', 'theoretical framing', 'EU innovation measures', 'use of qualifiers'}	{'EU innovation measures', 'data collection and reporting practices', 'coding and analysis workflow', 'prototyping and validation'}
17	R0:33			TRL scales progresses up to level 9, that is reachability to market.	{'proof-of-concept', 'qualifiers', 'theoretical', 'EU measures'}	current situation	{'proof-of-concept', 'qualifiers', 'theoretical', 'EU measures'}	{'proof-of-concept', 'theoretical framing', 'EU innovation measures', 'use of qualifiers'}	{'EU innovation measures', 'data collection and reporting practices', 'coding and analysis workflow', 'prototyping and validation'}
18	R0:34			In between, 4 -6, there a projects that [ measures innovation] from research and development [stage] to validation of a product or a service in a real but controlled environment, like a case study created in a company.	{'product or service validation', 'EU measures'}	insight	{'product or service validation', 'EU measures'}	{'EU innovation measures', 'product or service validation'}	{'EU innovation measures', 'product or service validation'}
18	R0:34			In between, 4 -6, there a projects that [ measures innovation] from research and development [stage] to validation of a product or a service in a real but controlled environment, like a case study created in a company.	{'product or service validation', 'EU measures'}	current situation	{'product or service validation', 'EU measures'}	{'EU innovation measures', 'product or service validation'}	{'EU innovation measures', 'product or service validation'}
19	R0:35			The last TRLs are the ones from 6 to 9, that assumes innovation action taken at market level.	{'EU measures', 'market'}	insight	{'EU measures', 'market'}	{'EU innovation measures', 'market context'}	{'EU innovation measures', 'market context'}
19	R0:35			The last TRLs are the ones from 6 to 9, that assumes innovation action taken at market level.	{'EU measures', 'market'}	current situation	{'EU measures', 'market'}	{'EU innovation measures', 'market context'}	{'EU innovation measures', 'market context'}
20	R0:36			So, let’s say that innovation, in regards with EU project  - I assess innovation based on these TRLs, in my opinion the lowest TRLs represent the most innovative projects because, in them, scientific research is at top level.	{'most innovative projects are ones focused on scientific research more than tech transfer'}	perception	{'most innovative projects are ones focused on scientific research more than tech transfer'}	{'science-focused projects seen as more innovative'}	{'innovation purpose and definition'}
21	R0:37			Then, progressively, scientific research decays in favor of industrial development, so there is a mix of the two.	{'most innovative projects are ones focused on scientific research more than tech transfer'}	perception	{'most innovative projects are ones focused on scientific research more than tech transfer'}	{'science-focused projects seen as more innovative'}	{'innovation purpose and definition'}
22	R0:38			The [X] project, being funded with a low TLR, is highly innovative if I wish to classify it, and it would yield at highly innovative results with respects to level 9 TRLs, were we may have projects already in industrial phase but that may have only a performance of 60%, so [innovation] would be finding a way to improve it, but there is already something [existing].	{'maximise or optimise'}	current situation	{'maximise or optimise'}	{'optimization focus'}	{'innovation definition and purpose'}
22	R0:38			The [X] project, being funded with a low TLR, is highly innovative if I wish to classify it, and it would yield at highly innovative results with respects to level 9 TRLs, were we may have projects already in industrial phase but that may have only a performance of 60%, so [innovation] would be finding a way to improve it, but there is already something [existing].	{'maximise or optimise'}	perception	{'maximise or optimise'}	{'optimization focus'}	{'innovation definition and purpose'}
23	R0:39			Here, as you see as when I was speaking about expectation, we are not yet at the level we have an existing product or service, and we don’t know yet a the spin-off may be about.	{'innovation strategy'}	uncertainty	{'innovation strategy'}	{'innovation strategy'}	{'innovation strategy and roadmapping'}
23	R0:39			Here, as you see as when I was speaking about expectation, we are not yet at the level we have an existing product or service, and we don’t know yet a the spin-off may be about.	{'innovation strategy'}	current situation	{'innovation strategy'}	{'innovation strategy'}	{'innovation strategy and roadmapping'}
24	R0:43			An advancement with respect to the state of the art, that is incremental, and that yields an added value.	{'innovation measured as advances with respect to state of the art'}	perception	{'innovation measured as advances with respect to state of the art'}	{'innovation measured vs state of the art'}	{'state-of-the-art comparison metric'}
25	R0:44			Let’s say like this, it is any incremental process with respect to prior art that leads to some sort of benefits, that could be environmental benefits, economic benefits, social benefits…	{'innovation measured as advances with respect to state of the art'}	perception	{'innovation measured as advances with respect to state of the art'}	{'innovation measured vs state of the art'}	{'state-of-the-art comparison metric'}
26	R0:48			Respondent - …It is very difficult to answer this.	{'uncertainty about innovation steps'}	uncertainty	{'uncertainty about innovation steps'}	{'uncertainty about innovation steps'}	{'uncertainty and risk perception'}
27	R0:49			Certainly, trying to understand the state of the art, and then from there try to figure out how much you move with respect to it.	{'prior enabling posterior'}	perception	{'prior enabling posterior'}	{'prior steps enabling later outcomes'}	{'prior enabling posterior'}
28	R0:50			Controlling progress with respect to state-of-art surely is an indicator, and then on the day-by-day operations there is a working plan to abide by.	{'progress VS state-of-the-art', 'management practices'}	insight	{'progress VS state-of-the-art', 'management practices'}	{'management practices', 'progress relative to state-of-the-art'}	{'management practices', 'state-of-the-art comparison'}
29	R0:51			Surely there are also alternatives solutions to be understood - anyway, let’s say innovation starts from an identified problem to solve,  and if there is a problem to solve there is a need, and so it is an answer [to a need].	{'day-to-day working plan', 'timescale'}	perception	{'day-to-day working plan', 'timescale'}	{'daily work planning', 'timescale'}	{'day-to-day research planning', 'innovation timescale and cadence'}
30	R0:53			No? I mean, there is always an alternative that must be worse than ours, otherwise it would mean we were not innovating.	{'must help discriminate about choices'}	perception	{'must help discriminate about choices'}	{'decision support requirement'}	{'decision support and reflection'}
31	R0:54			So considering state-of-the-art, it means also look at technical solutions by competitors, that provide an alternative service, and look if theirs is state-of-the-art.	{'state-of-the-art must help look against competitors'}	insight	{'state-of-the-art must help look against competitors'}	{'state-of-the-art vs competitors'}	{'market and competitive context'}
32	R0:57			Respondent - Yes, yes, like the ones we have in our company, that belong to [X] group, we have an open innovation platform.	{'exposure to innovation management'}	current situation	{'exposure to innovation management'}	{'exposure to innovation management'}	{'exposure to innovation management tools'}
33	R0:61			For example, sharing of protected information, it is not an open-accessed platform.	{'innovation management is intellectual property management'}	insight	{'innovation management is intellectual property management'}	{'innovation management as IP management'}	{'innovation management as IP governance'}
34	R0:63			We can also access a database of clients and from there look at which managed project we supported with funding-request applications, look at partenariats and affiliated users of our so-called innovation platform and read their newsletter.	{'prior enabling posterior', 'innovation management is managing assets', 'databases as assets'}	assets	{'prior enabling posterior', 'innovation management is managing assets', 'databases as assets'}	{'innovation management as asset management', 'databases as innovation assets', 'prior steps enabling later outcomes'}	{'prior enabling posterior', 'data and databases as innovation assets', 'innovation management as asset governance'}
34	R0:63			We can also access a database of clients and from there look at which managed project we supported with funding-request applications, look at partenariats and affiliated users of our so-called innovation platform and read their newsletter.	{'prior enabling posterior', 'innovation management is managing assets', 'databases as assets'}	current situation	{'prior enabling posterior', 'innovation management is managing assets', 'databases as assets'}	{'innovation management as asset management', 'databases as innovation assets', 'prior steps enabling later outcomes'}	{'prior enabling posterior', 'data and databases as innovation assets', 'innovation management as asset governance'}
35	R0:68			We have the ability to extract data from excel and draw histograms and pie-charts, but respond to queries we run against our databases.	{'excels'}	insight	{'excels'}	{'excellence outcomes'}	{'excellence outcomes'}
36	R0:69			As example, we can extract information from the database and have an excel table, and from there have visualisations that are functional to our query, but not strictly related to innovation per-se.	{'charts'}	insight	{'charts'}	{'use of charts'}	{'tools and visualization'}
37	R0:72			Respondent - Mmmm… I don’t have a total overview of this specific project, we are partners.	{'uncertainty about genesis of innovation'}	uncertainty	{'uncertainty about genesis of innovation'}	{'uncertainty about innovation genesis'}	{'uncertainty and risk perception'}
37	R0:72			Respondent - Mmmm… I don’t have a total overview of this specific project, we are partners.	{'uncertainty about genesis of innovation'}	current situation	{'uncertainty about genesis of innovation'}	{'uncertainty about innovation genesis'}	{'uncertainty and risk perception'}
38	R0:73			But if I was project manager, I would organize periodically meetings - a meeting per month as minimum -for each work package.	{'timescale', 'periodic meetings allows an overview therefore genesis of innovation', 'meetings at least monthly for each sub-group'}	insight	{'timescale', 'periodic meetings allows an overview therefore genesis of innovation', 'meetings at least monthly for each sub-group'}	{'monthly subgroup meetings', 'timescale', 'periodic meetings enable innovation overview'}	{'coordination practices', 'innovation timescale and cadence'}
38	R0:73			But if I was project manager, I would organize periodically meetings - a meeting per month as minimum -for each work package.	{'timescale', 'periodic meetings allows an overview therefore genesis of innovation', 'meetings at least monthly for each sub-group'}	perception	{'timescale', 'periodic meetings allows an overview therefore genesis of innovation', 'meetings at least monthly for each sub-group'}	{'monthly subgroup meetings', 'timescale', 'periodic meetings enable innovation overview'}	{'coordination practices', 'innovation timescale and cadence'}
39	R0:75			There could be weekly meetings every two weeks… each week, I think more suitable for other project.	{'timescale', 'timescale for innovation is weekly'}	insight	{'timescale', 'timescale for innovation is weekly'}	{'weekly innovation timescale', 'timescale'}	{'innovation timescale and cadence'}
40	R0:80			I think it is important to involve all partners with regular frequency because dissemination and communication activities are activities where all partners are obligated to attend by the European Community, but this does not always happen depending on partners… Anyway I look for continuity at least when in key moments, if there are concrete results… For example, we have a survey and must be finalized in time and we must meet so that there is enough time to discuss and edit it so that, if we must include an important point to measure in the [research and development] pathway, we can do it so that we can get first results and discuss them in the next meeting.	{'innovation steps conceived as surveys', 'regular frequency to share innovation steps with all partners is important'}	insight	{'innovation steps conceived as surveys', 'regular frequency to share innovation steps with all partners is important'}	{'importance of regular sharing with partners', 'innovation steps as surveys'}	{'regular sharing with partners importance', 'survey-based step capture'}
40	R0:80			I think it is important to involve all partners with regular frequency because dissemination and communication activities are activities where all partners are obligated to attend by the European Community, but this does not always happen depending on partners… Anyway I look for continuity at least when in key moments, if there are concrete results… For example, we have a survey and must be finalized in time and we must meet so that there is enough time to discuss and edit it so that, if we must include an important point to measure in the [research and development] pathway, we can do it so that we can get first results and discuss them in the next meeting.	{'innovation steps conceived as surveys', 'regular frequency to share innovation steps with all partners is important'}	perception	{'innovation steps conceived as surveys', 'regular frequency to share innovation steps with all partners is important'}	{'importance of regular sharing with partners', 'innovation steps as surveys'}	{'regular sharing with partners importance', 'survey-based step capture'}
41	R0:81			However let’s say that for indicators on technical progress you should ask to other work package leaders because my role is more on the dissemination and communication side.	{'uncertainty'}	perception	{'uncertainty'}	{'uncertainty'}	{'uncertainty and risk perception'}
42	R0:85			Respondent - Certainly yes.	{'innovation steps as micro-data are certinaly valuable'}	opportunity	{'innovation steps as micro-data are certinaly valuable'}	{'value of micro-data innovation steps'}	{'innovation steps value and utility'}
43	R0:86			First of all, being of diverse expertises is extremely useful to collect diverse points of views.	{'diversity of expertises as assets'}	opportunity	{'diversity of expertises as assets'}	{'diversity of expertise as asset'}	{'diversity of expertise as innovation resource'}
44	R0:87			Anyone, the focus of our company is on the exposition [of research driven activities, so it is appropriate that, like] in this case one must have a minimum of relevant background with the project being worked on, otherwise it is extremely difficult to enter in the scientific aspects of the project itself.	{'qualified background is necessary'}	perception	{'qualified background is necessary'}	{'need for qualified background'}	{'qualified background requirement'}
45	R0:88			Hence, I have been working, I am a biomedical engineer, but then I hold a PhD on mechanical systems and have worked on a robotics lab, so even if I don’t handle all the details of the project, I have an understanding that can help in appreciating different points of views.	{'personal purpose VS working purpose', 'minimum qualified expertise'}	perception	{'personal purpose VS working purpose', 'minimum qualified expertise'}	{'tension between personal and work purpose', 'minimum expertise requirement'}	{'qualified background requirement', 'tensions between roles and purposes'}
