	ID	QID	QID_	Sentence	Codes	Themes	FirstCC	SecondCC	ThirdCC
383	R4:114		Q:21b	Short videos for public audiences: ++ 	{'describing innovation steps with videos is important (3/4)', 'videos for outreach', 'communication to public', 'prototype guidelines'}	insight	{'describing innovation steps with videos is important (3/4)', 'videos for outreach', 'communication to public', 'prototype guidelines'}	{'public communication', 'prototype guidelines', 'videos for outreach', 'importance of video descriptions'}	{'relevance of video for step description', 'data formats for describing steps', 'prototype guidelines', 'public communication practices'}
383	R4:114		Q:21b	Short videos for public audiences: ++ 	{'describing innovation steps with videos is important (3/4)', 'videos for outreach', 'communication to public', 'prototype guidelines'}	appropriate language	{'describing innovation steps with videos is important (3/4)', 'videos for outreach', 'communication to public', 'prototype guidelines'}	{'public communication', 'prototype guidelines', 'videos for outreach', 'importance of video descriptions'}	{'relevance of video for step description', 'data formats for describing steps', 'prototype guidelines', 'public communication practices'}
384	R4:115		Q:21c	Data-visualization: +++	{'describing innovation steps with data-visualisation is very important (4/4)', 'prototype guidelines', 'data-visualisation for public', 'communication to public'}	insight	{'describing innovation steps with data-visualisation is very important (4/4)', 'prototype guidelines', 'data-visualisation for public', 'communication to public'}	{'public communication', 'prototype guidelines', 'data visualization for public communication', 'high relevance of data visualization for steps'}	{'relevance of data visualization for step description', 'prototype guidelines', 'data visualization for public communication', 'public communication practices'}
384	R4:115		Q:21c	Data-visualization: +++	{'describing innovation steps with data-visualisation is very important (4/4)', 'prototype guidelines', 'data-visualisation for public', 'communication to public'}	appropriate language	{'describing innovation steps with data-visualisation is very important (4/4)', 'prototype guidelines', 'data-visualisation for public', 'communication to public'}	{'public communication', 'prototype guidelines', 'data visualization for public communication', 'high relevance of data visualization for steps'}	{'relevance of data visualization for step description', 'prototype guidelines', 'data visualization for public communication', 'public communication practices'}
385	R4:117			Title of the step, Description Objective / purpose, Preliminary results, Next actions	{'prototype guidelines', 'key fields for innovation data collection', 'structured innovation steps'}	insight	{'prototype guidelines', 'key fields for innovation data collection', 'structured innovation steps'}	{'prototype guidelines', 'structured innovation steps', 'key fields for data collection'}	{'data collection schema requirements', 'prototype guidelines', 'innovation steps and granularity'}
386	R4:119		Q:23	Yes. Pros: allowing people to vote or rate innovation steps encourages contribution and engagement. 	{'Voting on innovation steps encourages engagement but risks early disclosure.'}	opportunity	{'Voting on innovation steps encourages engagement but risks early disclosure.'}	{'voting on innovation steps trade-offs'}	{'voting and decision-making governance'}
386	R4:119		Q:23	Yes. Pros: allowing people to vote or rate innovation steps encourages contribution and engagement. 	{'Voting on innovation steps encourages engagement but risks early disclosure.'}	perception	{'Voting on innovation steps encourages engagement but risks early disclosure.'}	{'voting on innovation steps trade-offs'}	{'voting and decision-making governance'}
387	R4:120		Q:23	Cons: there is a risk of revealing sensitive data or critical information before patenting or commercialization	{'Voting on innovation steps encourages engagement but risks early disclosure.'}	critics	{'Voting on innovation steps encourages engagement but risks early disclosure.'}	{'voting on innovation steps trade-offs'}	{'voting and decision-making governance'}
388	R4:122		Q:24	Yes. The main advantage is that when an issue arises, it becomes much easier to trace its origin, understand the decisions taken, and solve the problem efficiently. Traceability also helps maintain clarity in the development process. 	{'traceability aids accountability', 'traeability aids understanding decisions'}	opportunity	{'traceability aids accountability', 'traeability aids understanding decisions'}	{'traceability supports accountability', 'traceability aids decision understanding'}	{'traceability benefits'}
388	R4:122		Q:24	Yes. The main advantage is that when an issue arises, it becomes much easier to trace its origin, understand the decisions taken, and solve the problem efficiently. Traceability also helps maintain clarity in the development process. 	{'traceability aids accountability', 'traeability aids understanding decisions'}	perception	{'traceability aids accountability', 'traeability aids understanding decisions'}	{'traceability supports accountability', 'traceability aids decision understanding'}	{'traceability benefits'}
389	R4:123		Q:24	However, it also increases the risk of exposing personal information or reducing individual privacy if not managed carefully.	{'traceability privacy concerns'}	disadvantages	{'traceability privacy concerns'}	{'privacy concerns of traceability'}	{'traceability privacy concerns'}
390	R4:129		Q:25b	I prefer “open to all selected participants.”	{'traceability of contributors should be open to participants'}	perception	{'traceability of contributors should be open to participants'}	{'open traceability to participants'}	{'open traceability preferences'}
391	R4:131		Q:26	Pros: Traceability is available within a controlled environment, which supports accountability, recognition, clearer problem-solving, and a good understanding of who contributed what, without exposing identities to the entire public. 	{'accountability', 'valuing authorship'}	assets	{'accountability', 'valuing authorship'}	{'accountability', 'valuing authorship'}	{'accountability', 'authorship and rewards'}
392	R4:132		Q:26	Cons: Even within a restricted group, there is still a reduction of privacy and a risk of bias toward some contributors. People may feel judged internally, and contributions might be evaluated personally rather than purely on their content	{'internal bias risk'}	disadvantages	{'internal bias risk'}	{'internal bias risk'}	{'internal bias risk'}
393	R4:139		Q:27d	Disagree. Property rights should only be relevant to archived publications and products, and should not block any possible spin-offs resulting from insights that were not capitalized within the original research.	{'property rights should not block spin-offs', 'property rights critics', 'spin-off enabling'}	insight	{'property rights should not block spin-offs', 'property rights critics', 'spin-off enabling'}	{'property rights should not block spin-offs', 'criticism of property rights', 'enabling spin-offs'}	{'criticism of property rights', 'property rights & entrepreneurship enabling', 'enabling spin-offs'}
393	R4:139		Q:27d	Disagree. Property rights should only be relevant to archived publications and products, and should not block any possible spin-offs resulting from insights that were not capitalized within the original research.	{'property rights should not block spin-offs', 'property rights critics', 'spin-off enabling'}	critics	{'property rights should not block spin-offs', 'property rights critics', 'spin-off enabling'}	{'property rights should not block spin-offs', 'criticism of property rights', 'enabling spin-offs'}	{'criticism of property rights', 'property rights & entrepreneurship enabling', 'enabling spin-offs'}
394	R4:142		Q:28	Yes, they should be rewarded. Even if they were already compensated for their work, the future value and impact of their insights justify additional recognition or reward.	{'delayed return of value of innovation beyond salary', 'valuing authorship'}	assets	{'delayed return of value of innovation beyond salary', 'valuing authorship'}	{'delayed value realization beyond salary', 'valuing authorship'}	{'delayed value realization beyond salary', 'authorship and rewards'}
395	R4:149		Q:28b	By the end of the week.	{'frequency of traceability', 'weekly reporting'}	current situation	{'frequency of traceability', 'weekly reporting'}	{'traceability frequency', 'weekly reporting'}	{'communication timing and frequency', 'reporting and communication practices'}
396	R4:157		Q:30c	Their own partners, with selective disclosure of sensitive insights: Yes 	{'innovation progress should only revealed to team and partners', 'reporting rules', 'selective disclosure'}	appropriate language	{'innovation progress should only revealed to team and partners', 'reporting rules', 'selective disclosure'}	{'reporting rules', 'selective disclosure', 'limited disclosure to team and partners'}	{'selective disclosure preferences', 'governance and policy design', 'IP governance and disclosure'}
396	R4:157		Q:30c	Their own partners, with selective disclosure of sensitive insights: Yes 	{'innovation progress should only revealed to team and partners', 'reporting rules', 'selective disclosure'}	perception	{'innovation progress should only revealed to team and partners', 'reporting rules', 'selective disclosure'}	{'reporting rules', 'selective disclosure', 'limited disclosure to team and partners'}	{'selective disclosure preferences', 'governance and policy design', 'IP governance and disclosure'}
397	R4:160		Q:31	ideas not yet protected by IP, commercially sensitive concepts, incomplete or speculative ideas, confidential data, early-stage results that could be misunderstood.	{'disclosure limits', 'IP protection priority'}	uncertainty	{'disclosure limits', 'IP protection priority'}	{'disclosure limits', 'priority of IP protection'}	{'IP protection priority', 'disclosure limits and boundaries'}
398	R4:162		Q:32	high-level descriptions of progress, non-confidential achievements, general scientific goals, outcomes that are already published, safe summaries without technical secrets.	{'appropriate language for outreach'}	appropriate language	{'appropriate language for outreach'}	{'appropriate language for outreach'}	{'appropriate language'}
399	R4:164		Q:33	major milestones, technological potential, success stories, demonstrations or prototypes that are non-confidential, societal or scientific impact.	{'dissemination strategy', 'success stories'}	opportunity	{'dissemination strategy', 'success stories'}	{'dissemination strategy', 'success stories'}	{'innovation outcomes and success factors', 'dissemination strategy and planning'}
400	R4:166		Q:34	Advantages: Tracing and communicating incremental innovation steps increases transparency and shows how ideas and resources evolve over time. It helps stakeholders and scientific communities learn from intermediate results, avoid duplication, and identify promising directions earlier. 	{'tracing intermediate steps increases transparency', 'tracing intermediate steps aids learning', 'tracing intermediate steps avoids duplication', 'tracing intermediate steps aids roadmaps'}	opportunity	{'tracing intermediate steps increases transparency', 'tracing intermediate steps aids learning', 'tracing intermediate steps avoids duplication', 'tracing intermediate steps aids roadmaps'}	{'tracing avoids duplication', 'tracing aids learning', 'increased transparency from tracing', 'tracing aids roadmapping'}	{'tracing avoids duplication', 'pathway visualization and roadmapping', 'traceability benefits', 'transparency and fairness outcomes'}
400	R4:166		Q:34	Advantages: Tracing and communicating incremental innovation steps increases transparency and shows how ideas and resources evolve over time. It helps stakeholders and scientific communities learn from intermediate results, avoid duplication, and identify promising directions earlier. 	{'tracing intermediate steps increases transparency', 'tracing intermediate steps aids learning', 'tracing intermediate steps avoids duplication', 'tracing intermediate steps aids roadmaps'}	assets	{'tracing intermediate steps increases transparency', 'tracing intermediate steps aids learning', 'tracing intermediate steps avoids duplication', 'tracing intermediate steps aids roadmaps'}	{'tracing avoids duplication', 'tracing aids learning', 'increased transparency from tracing', 'tracing aids roadmapping'}	{'tracing avoids duplication', 'pathway visualization and roadmapping', 'traceability benefits', 'transparency and fairness outcomes'}
400	R4:166		Q:34	Advantages: Tracing and communicating incremental innovation steps increases transparency and shows how ideas and resources evolve over time. It helps stakeholders and scientific communities learn from intermediate results, avoid duplication, and identify promising directions earlier. 	{'tracing intermediate steps increases transparency', 'tracing intermediate steps aids learning', 'tracing intermediate steps avoids duplication', 'tracing intermediate steps aids roadmaps'}	perception	{'tracing intermediate steps increases transparency', 'tracing intermediate steps aids learning', 'tracing intermediate steps avoids duplication', 'tracing intermediate steps aids roadmaps'}	{'tracing avoids duplication', 'tracing aids learning', 'increased transparency from tracing', 'tracing aids roadmapping'}	{'tracing avoids duplication', 'pathway visualization and roadmapping', 'traceability benefits', 'transparency and fairness outcomes'}
401	R4:167		Q:34	Disadvantages: Sharing every small step can create information overload and make it harder to see what is truly important. 	{'tracing intermediate steps causes information overload'}	uncertainty	{'tracing intermediate steps causes information overload'}	{'information overload from tracing'}	{'information overload risk'}
401	R4:167		Q:34	Disadvantages: Sharing every small step can create information overload and make it harder to see what is truly important. 	{'tracing intermediate steps causes information overload'}	disadvantages	{'tracing intermediate steps causes information overload'}	{'information overload from tracing'}	{'information overload risk'}
402	R4:168		Q:34	There is also a risk of misunderstanding preliminary results and of exposing sensitive or commercially relevant information too early, as well as putting extra pressure on researchers for every partial or failed attempt.	{'tracing intermediate steps psychological distress (failures VS expected results)', 'tracing intermediate steps causes risks of premature disclosure'}	uncertainty	{'tracing intermediate steps psychological distress (failures VS expected results)', 'tracing intermediate steps causes risks of premature disclosure'}	{'psychological distress from tracing', 'premature disclosure risk'}	{'psychological and social risks', 'premature disclosure risk'}
402	R4:168		Q:34	There is also a risk of misunderstanding preliminary results and of exposing sensitive or commercially relevant information too early, as well as putting extra pressure on researchers for every partial or failed attempt.	{'tracing intermediate steps psychological distress (failures VS expected results)', 'tracing intermediate steps causes risks of premature disclosure'}	disadvantages	{'tracing intermediate steps psychological distress (failures VS expected results)', 'tracing intermediate steps causes risks of premature disclosure'}	{'psychological distress from tracing', 'premature disclosure risk'}	{'psychological and social risks', 'premature disclosure risk'}
403	R4:170		Q:35	I believe small steps, even if they seem minor, are the real building blocks of any structure. Sometimes a very small innovation can create a huge and unexpected advantage. 	{'pattern discovery', 'meta-research opportunity'}	assets	{'pattern discovery', 'meta-research opportunity'}	{'pattern discovery', 'meta-research opportunity'}	{'meta-research opportunity', 'pattern understanding via tracing'}
403	R4:170		Q:35	I believe small steps, even if they seem minor, are the real building blocks of any structure. Sometimes a very small innovation can create a huge and unexpected advantage. 	{'pattern discovery', 'meta-research opportunity'}	perception	{'pattern discovery', 'meta-research opportunity'}	{'pattern discovery', 'meta-research opportunity'}	{'meta-research opportunity', 'pattern understanding via tracing'}
404	R4:171		Q:35	Tracing these steps should therefore help us understand how these micro-innovations accumulate into major discoveries and outcomes, and enable meta-research to uncover patterns in how discovery and innovation actually emerge over time.	{'pattern discovery', 'meta-research opportunity'}	opportunity	{'pattern discovery', 'meta-research opportunity'}	{'pattern discovery', 'meta-research opportunity'}	{'meta-research opportunity', 'pattern understanding via tracing'}
404	R4:171		Q:35	Tracing these steps should therefore help us understand how these micro-innovations accumulate into major discoveries and outcomes, and enable meta-research to uncover patterns in how discovery and innovation actually emerge over time.	{'pattern discovery', 'meta-research opportunity'}	assets	{'pattern discovery', 'meta-research opportunity'}	{'pattern discovery', 'meta-research opportunity'}	{'meta-research opportunity', 'pattern understanding via tracing'}
404	R4:171		Q:35	Tracing these steps should therefore help us understand how these micro-innovations accumulate into major discoveries and outcomes, and enable meta-research to uncover patterns in how discovery and innovation actually emerge over time.	{'pattern discovery', 'meta-research opportunity'}	perception	{'pattern discovery', 'meta-research opportunity'}	{'pattern discovery', 'meta-research opportunity'}	{'meta-research opportunity', 'pattern understanding via tracing'}
405	R5:2		Q:1	My name is [RESPONDANT 5], I am at [PARTNER ORGANIZATION]  and I am co-PI of [PROJECT X]	{'authorship', 'co-principal investigator', 'roles'}	current situation	{'authorship', 'co-principal investigator', 'roles'}	{'authorship attribution', 'co-principal investigator role', 'roles'}	{'roles and permissions governance', 'leadership roles', 'valuing authorship'}
406	R5:13		Q:4	"I used to think about this because this term has been discussed at my work place. But I do
not know what it means, and I have no time for defining such. Waste of time."	{'critics about current policy', 'innovation management is waste of time', 'uncertainty about innovation steps', 'sarcasm about innovation management'}	critics	{'critics about current policy', 'innovation management is waste of time', 'uncertainty about innovation steps', 'sarcasm about innovation management'}	{'innovation management seen as waste', 'criticism of current policy', 'uncertainty about innovation steps', 'sarcasm about innovation management'}	{'uncertainty and risk perception', 'criticism of policy', 'innovation management skepticism', 'criticism of innovation management'}
406	R5:13		Q:4	"I used to think about this because this term has been discussed at my work place. But I do
not know what it means, and I have no time for defining such. Waste of time."	{'critics about current policy', 'innovation management is waste of time', 'uncertainty about innovation steps', 'sarcasm about innovation management'}	perception	{'critics about current policy', 'innovation management is waste of time', 'uncertainty about innovation steps', 'sarcasm about innovation management'}	{'innovation management seen as waste', 'criticism of current policy', 'uncertainty about innovation steps', 'sarcasm about innovation management'}	{'uncertainty and risk perception', 'criticism of policy', 'innovation management skepticism', 'criticism of innovation management'}
407	R5:15		Q:5	I do not know what it means, and I have no time for defining such.	{'innovation management is waste of time', 'sarcasm about innovation management'}	critics	{'innovation management is waste of time', 'sarcasm about innovation management'}	{'innovation management seen as waste', 'sarcasm about innovation management'}	{'innovation management skepticism', 'criticism of innovation management'}
407	R5:15		Q:5	I do not know what it means, and I have no time for defining such.	{'innovation management is waste of time', 'sarcasm about innovation management'}	disadvantages	{'innovation management is waste of time', 'sarcasm about innovation management'}	{'innovation management seen as waste', 'sarcasm about innovation management'}	{'innovation management skepticism', 'criticism of innovation management'}
407	R5:15		Q:5	I do not know what it means, and I have no time for defining such.	{'innovation management is waste of time', 'sarcasm about innovation management'}	perception	{'innovation management is waste of time', 'sarcasm about innovation management'}	{'innovation management seen as waste', 'sarcasm about innovation management'}	{'innovation management skepticism', 'criticism of innovation management'}
408	R5:19		Q:7	This sounds to me bureaucratic. If I get inspiration from something and produce based on that, and later report it, I try to make transparent where my ideas originate from. It is a matter of historical correctness and fairness to those who were and worked before me.	{'tracing innovation steps is waste of time', 'ideas and background only to be reported only when something is produced'}	critics	{'tracing innovation steps is waste of time', 'ideas and background only to be reported only when something is produced'}	{'tracing seen as waste of time', 'ideas disclosed only after production'}	{'conditional idea disclosure', 'traceability risks and costs'}
408	R5:19		Q:7	This sounds to me bureaucratic. If I get inspiration from something and produce based on that, and later report it, I try to make transparent where my ideas originate from. It is a matter of historical correctness and fairness to those who were and worked before me.	{'tracing innovation steps is waste of time', 'ideas and background only to be reported only when something is produced'}	disadvantages	{'tracing innovation steps is waste of time', 'ideas and background only to be reported only when something is produced'}	{'tracing seen as waste of time', 'ideas disclosed only after production'}	{'conditional idea disclosure', 'traceability risks and costs'}
408	R5:19		Q:7	This sounds to me bureaucratic. If I get inspiration from something and produce based on that, and later report it, I try to make transparent where my ideas originate from. It is a matter of historical correctness and fairness to those who were and worked before me.	{'tracing innovation steps is waste of time', 'ideas and background only to be reported only when something is produced'}	perception	{'tracing innovation steps is waste of time', 'ideas and background only to be reported only when something is produced'}	{'tracing seen as waste of time', 'ideas disclosed only after production'}	{'conditional idea disclosure', 'traceability risks and costs'}
409	R5:22		Q:a	"If I give an answer here, it will take me too much time. By the way: By default,
this creepy MSCopilot interferes with what I want to write, therefore I stop here."	{'critics about current tools (Microsoft OR Generative AI interferences)', 'tools for innovation management', 'sarcasms about innovation management'}	critics	{'critics about current tools (Microsoft OR Generative AI interferences)', 'tools for innovation management', 'sarcasms about innovation management'}	{'innovation management tools', 'criticism of current tools', 'sarcasm about innovation management'}	{'criticism of current tools', 'innovation management tools and platforms', 'criticism of innovation management'}
409	R5:22		Q:a	"If I give an answer here, it will take me too much time. By the way: By default,
this creepy MSCopilot interferes with what I want to write, therefore I stop here."	{'critics about current tools (Microsoft OR Generative AI interferences)', 'tools for innovation management', 'sarcasms about innovation management'}	disadvantages	{'critics about current tools (Microsoft OR Generative AI interferences)', 'tools for innovation management', 'sarcasms about innovation management'}	{'innovation management tools', 'criticism of current tools', 'sarcasm about innovation management'}	{'criticism of current tools', 'innovation management tools and platforms', 'criticism of innovation management'}
409	R5:22		Q:a	"If I give an answer here, it will take me too much time. By the way: By default,
this creepy MSCopilot interferes with what I want to write, therefore I stop here."	{'critics about current tools (Microsoft OR Generative AI interferences)', 'tools for innovation management', 'sarcasms about innovation management'}	perception	{'critics about current tools (Microsoft OR Generative AI interferences)', 'tools for innovation management', 'sarcasms about innovation management'}	{'innovation management tools', 'criticism of current tools', 'sarcasm about innovation management'}	{'criticism of current tools', 'innovation management tools and platforms', 'criticism of innovation management'}
410	R5:57		Q:14a	"[INTERVIEWER_NAME], I am sorry you have to do this kind of job. I use
the tools that I have in reach if they are useful. It is good if one can show a real product, a
