	ID	QID	QID_	Sentence	Codes	Themes	FirstCC	SecondCC	ThirdCC
445	R6:153	Q:31	Q:31	In your perception, which type of insights or ideas should be not disclosed to partners, if there is any ?	{'legal', 'innovation disclosure should depend on audience', 'business strategy', 'selective non-disclosure', 'selective non-disclosure depending on risks (ethical', 'security )'}	critics	{'legal', 'innovation disclosure should depend on audience', 'business strategy', 'selective non-disclosure', 'selective non-disclosure depending on risks (ethical', 'security )'}	{'legal context', 'audience-dependent innovation disclosure', 'risk-based non-disclosure', 'business strategy', 'selective non-disclosure', 'security concerns'}	{'audience-dependent disclosure', 'business strategy', 'selective non-disclosure', 'legal and IP context', 'IP governance and disclosure'}
446	R6:156	Q:32	Q:32	In your perception, which type of information about innovation steps could be communicated to the public or to third parties organizations ?	{'', 'selective non-disclosure', 'innovation disclosure should depend on audience'}	insight	{'', 'selective non-disclosure', 'innovation disclosure should depend on audience'}	{'', 'selective non-disclosure', 'audience-dependent innovation disclosure'}	{'', 'selective non-disclosure', 'audience-dependent disclosure'}
446	R6:156	Q:32	Q:32	In your perception, which type of information about innovation steps could be communicated to the public or to third parties organizations ?	{'', 'selective non-disclosure', 'innovation disclosure should depend on audience'}	critics	{'', 'selective non-disclosure', 'innovation disclosure should depend on audience'}	{'', 'selective non-disclosure', 'audience-dependent innovation disclosure'}	{'', 'selective non-disclosure', 'audience-dependent disclosure'}
447	R6:158	Q:33	Q:33	In your perception, which type of information about innovation steps should be communicated to the public or to third parties organizations, so as to promote the outreach of Cogitor ?	{'promotion through high level research themes', 'innovation steps for public outreach should communicate what/how impact as applied technological opportunities', 'outreach via visionary domains'}	insight	{'promotion through high level research themes', 'innovation steps for public outreach should communicate what/how impact as applied technological opportunities', 'outreach via visionary domains'}	{'public outreach focuses on applied impact', 'visionary outreach strategies', 'promotion via high-level research themes'}	{'outreach and public engagement communication', 'outreach and dissemination', 'outreach framing'}
447	R6:158	Q:33	Q:33	In your perception, which type of information about innovation steps should be communicated to the public or to third parties organizations, so as to promote the outreach of Cogitor ?	{'promotion through high level research themes', 'innovation steps for public outreach should communicate what/how impact as applied technological opportunities', 'outreach via visionary domains'}	opportunity	{'promotion through high level research themes', 'innovation steps for public outreach should communicate what/how impact as applied technological opportunities', 'outreach via visionary domains'}	{'public outreach focuses on applied impact', 'visionary outreach strategies', 'promotion via high-level research themes'}	{'outreach and public engagement communication', 'outreach and dissemination', 'outreach framing'}
448	R6:162		Q:34	Tracing and communicating incremental innovation steps can significantly enhance learning, coordination, and trust, but only when supported by clear framing, selective visibility, and lightweight governance. 	{'tracing innovation steps for awareness', 'learning'}	opportunity	{'tracing innovation steps for awareness', 'learning'}	{'learning outcomes', 'tracing for awareness'}	{'traceability benefits', 'learning from failures'}
449	R6:163		Q:34	When poorly managed, the same practices may hinder experimentation and strategic positioning. 	{'critics', 'trade-off', 'communication innovation to third parties'}	disadvantages	{'critics', 'trade-off', 'communication innovation to third parties'}	{'trade-offs involved', 'criticism', 'communication of innovation to third parties'}	{'trade-offs and balancing', 'criticism', 'third-party communication'}
450	R6:164		Q:34	Pros: enhanced collective learning, improved coordination and alignment, early feedback and quality improvement, transparency and trust, knowledge preservation, and cultural benefits. 	{'tracing innovation steps for awareness', 'learning'}	opportunity	{'tracing innovation steps for awareness', 'learning'}	{'learning outcomes', 'tracing for awareness'}	{'traceability benefits', 'learning from failures'}
451	R6:165		Q:34	Cons: Risk of information overload, misinterpretation of provisional work, strategic and competitive exposure, reduced willingness to experiment, increased administrative burden, and intellectual property risks.	{'information overload', 'tampering existing practices', 'IP risks'}	critics	{'information overload', 'tampering existing practices', 'IP risks'}	{'information overload', 'disruption of existing practices', 'risks related to intellectual property'}	{'disruption of existing practices', 'IP governance and disclosure', 'information overload risk'}
452	R6:166	Q:35	Q:35	In your opinion, what kind of results should tracing innovation steps lead to, as an opportunity for pioneering opportunities of meta-research over the emergence of discovery and innovation in research activities ?	{'assets', 'learning'}	assets	{'assets', 'learning'}	{'learning outcomes', 'assets as innovation components'}	{'assets as innovation components', 'learning from failures'}
453	R6:167		Q:35	Tracing innovation steps through results like Empirical models of discovery and innovation, identification of critical inflection points, mapping knowledge recombination, distinguishing between failure and negative results, social and organizational dynamics of innovation, other dynamics (like time, effort, and resources), bias, path dependence, lock-in-effects, impact predictors and translational success - can serve as opportunities of meta-research over the emergence of discovery and innovation in research activities. 	{'efficacy of using set of resources)', 'meta-knowledge on (knowledge recombination', 'organisational structures favouring innovation', 'negative results are not failures'}	insight	{'efficacy of using set of resources)', 'meta-knowledge on (knowledge recombination', 'organisational structures favouring innovation', 'negative results are not failures'}	{'negative results reframed as non-failure', 'meta-knowledge on recombination', 'efficacy of resource utilization', 'organizational structures enabling innovation'}	{'meta-research opportunity', 'resource utilization efficacy', 'failures and negative results', 'organizational structures enabling innovation'}
453	R6:167		Q:35	Tracing innovation steps through results like Empirical models of discovery and innovation, identification of critical inflection points, mapping knowledge recombination, distinguishing between failure and negative results, social and organizational dynamics of innovation, other dynamics (like time, effort, and resources), bias, path dependence, lock-in-effects, impact predictors and translational success - can serve as opportunities of meta-research over the emergence of discovery and innovation in research activities. 	{'efficacy of using set of resources)', 'meta-knowledge on (knowledge recombination', 'organisational structures favouring innovation', 'negative results are not failures'}	opportunity	{'efficacy of using set of resources)', 'meta-knowledge on (knowledge recombination', 'organisational structures favouring innovation', 'negative results are not failures'}	{'negative results reframed as non-failure', 'meta-knowledge on recombination', 'efficacy of resource utilization', 'organizational structures enabling innovation'}	{'meta-research opportunity', 'resource utilization efficacy', 'failures and negative results', 'organizational structures enabling innovation'}
453	R6:167		Q:35	Tracing innovation steps through results like Empirical models of discovery and innovation, identification of critical inflection points, mapping knowledge recombination, distinguishing between failure and negative results, social and organizational dynamics of innovation, other dynamics (like time, effort, and resources), bias, path dependence, lock-in-effects, impact predictors and translational success - can serve as opportunities of meta-research over the emergence of discovery and innovation in research activities. 	{'efficacy of using set of resources)', 'meta-knowledge on (knowledge recombination', 'organisational structures favouring innovation', 'negative results are not failures'}	assets	{'efficacy of using set of resources)', 'meta-knowledge on (knowledge recombination', 'organisational structures favouring innovation', 'negative results are not failures'}	{'negative results reframed as non-failure', 'meta-knowledge on recombination', 'efficacy of resource utilization', 'organizational structures enabling innovation'}	{'meta-research opportunity', 'resource utilization efficacy', 'failures and negative results', 'organizational structures enabling innovation'}
454	R6:169		Q:35	This enables a shift from studying what research produces to understanding how it produces value - opening new frontiers in meta-research and research governance.	{'policy', 'opportunity'}	opportunity	{'policy', 'opportunity'}	{'opportunity', 'policy framework'}	{'opportunity', 'policy framework'}
455	R7:2		Q:1	My role in [PROJECT X] regards the development of integrated circuits for in-memory computing for ferrofluids, the implementation of electronic demonstrators, and the investigation of liquid computing paradigms.	{'prototyping of new concepts', 'applied research', 'researcher'}	assets	{'prototyping of new concepts', 'applied research', 'researcher'}	{'researcher role', 'applied research context', 'prototyping new concepts'}	{'researcher role', 'applied research context', 'prototyping and validation'}
455	R7:2		Q:1	My role in [PROJECT X] regards the development of integrated circuits for in-memory computing for ferrofluids, the implementation of electronic demonstrators, and the investigation of liquid computing paradigms.	{'prototyping of new concepts', 'applied research', 'researcher'}	current situation	{'prototyping of new concepts', 'applied research', 'researcher'}	{'researcher role', 'applied research context', 'prototyping new concepts'}	{'researcher role', 'applied research context', 'prototyping and validation'}
456	R7:11		Q:4	Innovation is the application of better solutions to meet new requirements and/or market needs.	{'innovation purpose is apply new solution', 'market'}	perception	{'innovation purpose is apply new solution', 'market'}	{'innovation purpose as application', 'market context'}	{'market context', 'innovation purpose and orientation'}
457	R7:13		Q:5	1. Development of science	{'innovation mostly aims to develop'}	perception	{'innovation mostly aims to develop'}	{'innovation aimed at development'}	{'innovation purpose and orientation'}
458	R7:14		Q:5	2. Validation of science	{'innovation mostly aims to validate science'}	perception	{'innovation mostly aims to validate science'}	{'innovation aimed at science validation'}	{'innovation purpose and orientation'}
459	R7:15		Q:5	3. Definition of an application (that must meet a market need)	{'innovation mostly aims to develop a technology (science applied to fit a market need)'}	perception	{'innovation mostly aims to develop a technology (science applied to fit a market need)'}	{'innovation aimed at technology development'}	{'innovation purpose and orientation'}
460	R7:16		Q:5	4. Development of a technological demonstrator	{'innovation mostly aims to develop a technology (science applied to fit a market need)'}	perception	{'innovation mostly aims to develop a technology (science applied to fit a market need)'}	{'innovation aimed at technology development'}	{'innovation purpose and orientation'}
461	R7:17		Q:5	5. Refinement and improvement of the process/technology to increase TRL	{'innovation activities aims to increase TRL'}	perception	{'innovation activities aims to increase TRL'}	{'increasing TRL'}	{'technology readiness progression'}
462	R7:18		Q:5	6. (In parallel) definition of a business plan	{'innovation activities aims to develop a business plan while developing TRL'}	perception	{'innovation activities aims to develop a business plan while developing TRL'}	{'business planning alongside TRL development'}	{'tech transfer & TRL progression'}
463	R7:19		Q:5	7. Creation of a high TRL prototype with constraints based on the final market application.	{'innovation activities aims to fit a prototype to market through TRL'}	insight	{'innovation activities aims to fit a prototype to market through TRL'}	{'prototype-market fit via TRL'}	{'market orientation'}
463	R7:19		Q:5	7. Creation of a high TRL prototype with constraints based on the final market application.	{'innovation activities aims to fit a prototype to market through TRL'}	current situation	{'innovation activities aims to fit a prototype to market through TRL'}	{'prototype-market fit via TRL'}	{'market orientation'}
464	R7:20		Q:5	8. Business acceleration.	{'innovation lastly aims to accelarate business'}		{'innovation lastly aims to accelarate business'}	{'innovation aims to accelerate business'}	{'innovation purpose and orientation'}
465	R7:23		Q:6	I think it is necessary to finalize business before the start-up: 1. People (but it is not an in-kind resource), 2. People (but it is not an in-kind resource), 3. People (but it is not an in-kind resource)	{'people are the most important resource of innovation'}	perception	{'people are the most important resource of innovation'}	{'people as key innovation resource'}	{'people as key resource'}
466	R7:24		Q:6	4. Computers, 5. Consumables/Services to make the prototype (based on the prototype kind, more or less money)	{'computer and services to make a protoype are in-kind resources of innovation'}	perception	{'computer and services to make a protoype are in-kind resources of innovation'}	{'technical resources as in-kind innovation resources'}	{'resource management and constraints'}
467	R7:25		Q:6	6. Legal/IP Support, 7. Normative Support	{'legal and IP support are also in-kind resources of innovation'}	perception	{'legal and IP support are also in-kind resources of innovation'}	{'legal and IP support as resources'}	{'in-kind resources'}
468	R7:27		Q:7	Maybe, but it really depends on the type of research. In any case the word “trace” is not appropriate. 	{'tracing innovation is not appropriate'}	critics	{'tracing innovation is not appropriate'}	{'inappropriateness of tracing'}	{'tracing seen as inappropriate'}
469	R7:28		Q:7	The appropriate word is “extract”, if we are talking about a bottom-up approach. 	{'extracting innovation is more appropriate than tracing'}	perception	{'extracting innovation is more appropriate than tracing'}	{'preference for extraction over tracing'}	{'preference for extraction over tracing'}
470	R7:29		Q:7	Innovation means to meet market needs, therefore research would need to be created to focused properly on MARKET NEEDS to find SOLUTIONS, if this is the case. 	{'innovation must be focused on market needs'}	perception	{'innovation must be focused on market needs'}	{'market-focused innovation'}	{'market orientation'}
471	R7:30		Q:7	In any case even if the research has clear market objectives, during the pathway things are not linear and must be “extracted”, not traced. 	{'innovation eventually is extracted from activities fitting market objectives but not traced'}	critics	{'innovation eventually is extracted from activities fitting market objectives but not traced'}	{'extraction over tracing of innovation'}	{'preference for extraction over tracing'}
472	R7:31		Q:7	[PROJECT X] has been in my opinion already though to focus on market needs from the beginning. I am just saying this in general.	{'', 'project critics due to lack of clear market needs'}	critics	{'', 'project critics due to lack of clear market needs'}	{'', 'project critics due to lack of clear market needs'}	{'', 'project critics due to lack of clear market needs'}
472	R7:31		Q:7	[PROJECT X] has been in my opinion already though to focus on market needs from the beginning. I am just saying this in general.	{'', 'project critics due to lack of clear market needs'}	disadvantages	{'', 'project critics due to lack of clear market needs'}	{'', 'project critics due to lack of clear market needs'}	{'', 'project critics due to lack of clear market needs'}
473	R7:49		Q:10	No. Public disclosure means creating potential business issues. Tell the thing only after coming out or in any case, tell them “we are working on it, but we cannot say anything”. Rumors are fine.	{'delegation of commercialization', 'market awareness (not market driven)', 'science vs market logic', 'rejection of researcher-as-businessman', 'technology transfer as mediator'}		{'delegation of commercialization', 'market awareness (not market driven)', 'science vs market logic', 'rejection of researcher-as-businessman', 'technology transfer as mediator'}	{'delegation of commercialization', 'market awareness without market dominance', 'tech transfer as mediator', 'tension between science and market', 'rejection of researcher-business role'}	{'research-management relationship', 'tech transfer and commercialization practices', 'market context', 'tech transfer and market orientation'}
474	R7:72		Q:14	If innovation is applying something to fulfill a market need, then every market need deserves its own tool, so it is a nice activity but from a management point of view.	{'', 'tool relevance depends on context'}	insight	{'', 'tool relevance depends on context'}	{'', 'context-dependent tool relevance'}	{'', 'context-dependent tool relevance'}
474	R7:72		Q:14	If innovation is applying something to fulfill a market need, then every market need deserves its own tool, so it is a nice activity but from a management point of view.	{'', 'tool relevance depends on context'}	current situation	{'', 'tool relevance depends on context'}	{'', 'context-dependent tool relevance'}	{'', 'context-dependent tool relevance'}
475	R7:73		Q:14	It can be useful, but it needs to be tailored. Management does not mean filling Excels spreadsheets and reporting things, is to make sure that goals are achieved, and this takes time.	{'need for tailored tools', 'management focus on goals over reporting'}	insight	{'need for tailored tools', 'management focus on goals over reporting'}	{'need for tailored tools', 'management prioritizes goals'}	{'management practices', 'tool design requirements'}
475	R7:73		Q:14	It can be useful, but it needs to be tailored. Management does not mean filling Excels spreadsheets and reporting things, is to make sure that goals are achieved, and this takes time.	{'need for tailored tools', 'management focus on goals over reporting'}	critics	{'need for tailored tools', 'management focus on goals over reporting'}	{'need for tailored tools', 'management prioritizes goals'}	{'management practices', 'tool design requirements'}
476	R7:75		Q:14a	I am sorry I cannot do this because I don’t have an idea now on what market need I am referring to.	{'uncertainty about market need', 'tool relevance depends on context', 'basic activity tracking sufficient', 'need for tailored tools'}	insight	{'uncertainty about market need', 'tool relevance depends on context', 'basic activity tracking sufficient', 'need for tailored tools'}	{'uncertainty about market need', 'sufficiency of basic activity tracking', 'context-dependent tool relevance', 'need for tailored tools'}	{'data collection and reporting practices', 'uncertainty and risk perception', 'context-dependent tool relevance', 'tool design requirements'}
476	R7:75		Q:14a	I am sorry I cannot do this because I don’t have an idea now on what market need I am referring to.	{'uncertainty about market need', 'tool relevance depends on context', 'basic activity tracking sufficient', 'need for tailored tools'}	uncertainty	{'uncertainty about market need', 'tool relevance depends on context', 'basic activity tracking sufficient', 'need for tailored tools'}	{'uncertainty about market need', 'sufficiency of basic activity tracking', 'context-dependent tool relevance', 'need for tailored tools'}	{'data collection and reporting practices', 'uncertainty and risk perception', 'context-dependent tool relevance', 'tool design requirements'}
476	R7:75		Q:14a	I am sorry I cannot do this because I don’t have an idea now on what market need I am referring to.	{'uncertainty about market need', 'tool relevance depends on context', 'basic activity tracking sufficient', 'need for tailored tools'}	current situation	{'uncertainty about market need', 'tool relevance depends on context', 'basic activity tracking sufficient', 'need for tailored tools'}	{'uncertainty about market need', 'sufficiency of basic activity tracking', 'context-dependent tool relevance', 'need for tailored tools'}	{'data collection and reporting practices', 'uncertainty and risk perception', 'context-dependent tool relevance', 'tool design requirements'}
477	R7:76		Q:14a	I cannot say what is the best visualization tool for electronic development, but for sure annotating the progress of the activities on a list with date and time does a preliminary job. Post processing and rearrangement of this data can do the job but it really depends on the activity. 	{'uncertainty about market need', 'tool relevance depends on context', 'basic activity tracking sufficient', 'need for tailored tools'}	insight	{'uncertainty about market need', 'tool relevance depends on context', 'basic activity tracking sufficient', 'need for tailored tools'}	{'uncertainty about market need', 'sufficiency of basic activity tracking', 'context-dependent tool relevance', 'need for tailored tools'}	{'data collection and reporting practices', 'uncertainty and risk perception', 'context-dependent tool relevance', 'tool design requirements'}
477	R7:76		Q:14a	I cannot say what is the best visualization tool for electronic development, but for sure annotating the progress of the activities on a list with date and time does a preliminary job. Post processing and rearrangement of this data can do the job but it really depends on the activity. 	{'uncertainty about market need', 'tool relevance depends on context', 'basic activity tracking sufficient', 'need for tailored tools'}	uncertainty	{'uncertainty about market need', 'tool relevance depends on context', 'basic activity tracking sufficient', 'need for tailored tools'}	{'uncertainty about market need', 'sufficiency of basic activity tracking', 'context-dependent tool relevance', 'need for tailored tools'}	{'data collection and reporting practices', 'uncertainty and risk perception', 'context-dependent tool relevance', 'tool design requirements'}
477	R7:76		Q:14a	I cannot say what is the best visualization tool for electronic development, but for sure annotating the progress of the activities on a list with date and time does a preliminary job. Post processing and rearrangement of this data can do the job but it really depends on the activity. 	{'uncertainty about market need', 'tool relevance depends on context', 'basic activity tracking sufficient', 'need for tailored tools'}	current situation	{'uncertainty about market need', 'tool relevance depends on context', 'basic activity tracking sufficient', 'need for tailored tools'}	{'uncertainty about market need', 'sufficiency of basic activity tracking', 'context-dependent tool relevance', 'need for tailored tools'}	{'data collection and reporting practices', 'uncertainty and risk perception', 'context-dependent tool relevance', 'tool design requirements'}
478	R7:78		Q:15b	I cannot say. This really depends on how the tool is designed itself.	{'', 'tool relevance depends on context'}	uncertainty	{'', 'tool relevance depends on context'}	{'', 'context-dependent tool relevance'}	{'', 'context-dependent tool relevance'}
479	R7:81		Q:15	It depends on the tool itself. If the tool is meant to be used by the manager to track things, fine. If the tool instead needs to be used by the people to see who is going fast or not, and increase anxiety, or it is substituting the manager, then I don’t agree. 	{'concern about anxiety from performance visibility', 'tool relevance depends on intended use', 'acceptance of managerial tracking tools', 'opposition to tool replacing manager'}	insight	{'concern about anxiety from performance visibility', 'tool relevance depends on intended use', 'acceptance of managerial tracking tools', 'opposition to tool replacing manager'}	{'opposition to automated management', 'use-dependent tool relevance', 'anxiety due to performance visibility', 'acceptance of managerial tracking tools'}	{'opposition to automated management', 'psychological distress from visibility', 'context-dependent tool relevance', 'acceptance of managerial tracking tools'}
